{
  "$schema": "https://json-schema.org/draft/2020-12/schema",
  "$id": "https://jbrorepo.github.io/colony-ts/v1/schema.json",
  "title": "Colony Plugin Registry Index (v1)",
  "type": "object",
  "required": ["version", "updated", "plugins"],
  "properties": {
    "version": {
      "type": "string",
      "const": "1",
      "description": "Schema version. Bumped on breaking changes."
    },
    "updated": {
      "type": "string",
      "format": "date",
      "description": "ISO date the registry was last regenerated."
    },
    "schemaUrl": {
      "type": "string",
      "format": "uri",
      "description": "URL of this JSON Schema document."
    },
    "submitProcessUrl": {
      "type": "string",
      "format": "uri",
      "description": "URL of the human-readable submission process documentation."
    },
    "plugins": {
      "type": "array",
      "items": { "$ref": "#/$defs/Plugin" }
    }
  },
  "$defs": {
    "Plugin": {
      "type": "object",
      "required": ["id", "name", "description", "version", "author", "tags", "verified", "source"],
      "properties": {
        "id": {
          "type": "string",
          "pattern": "^[a-z][a-z0-9-]{2,63}$",
          "description": "Unique identifier. Lowercase, hyphen-separated, 3–64 chars. Used as install handle: `/plugins install <id>`."
        },
        "name": {
          "type": "string",
          "minLength": 2,
          "maxLength": 80,
          "description": "Human-readable display name."
        },
        "description": {
          "type": "string",
          "minLength": 20,
          "maxLength": 500,
          "description": "One-paragraph description shown in search results. Should explain the value, not just the surface area."
        },
        "version": {
          "type": "string",
          "pattern": "^\\d+\\.\\d+\\.\\d+(-[A-Za-z0-9.-]+)?$",
          "description": "Semver. Pre-release suffixes allowed (e.g. `1.0.0-beta.3`)."
        },
        "author": {
          "type": "string",
          "minLength": 2,
          "maxLength": 80,
          "description": "Author or organization name. Use `colony-team` for first-party plugins."
        },
        "tags": {
          "type": "array",
          "items": {
            "type": "string",
            "pattern": "^[a-z][a-z0-9-]{1,30}$"
          },
          "minItems": 1,
          "maxItems": 10,
          "description": "Searchable topic tags. Lowercase, hyphenated."
        },
        "verified": {
          "type": "boolean",
          "description": "True if reviewed by the Colony team for security and quality. Community plugins are still safe to install via the standard approval flow, but verified plugins get an additional review pass."
        },
        "source": {
          "type": "string",
          "pattern": "^(npm:|github:)",
          "description": "Install source. Prefixed by scheme: `npm:<package>` or `github:<owner>/<repo>`."
        },
        "homepageUrl": {
          "type": "string",
          "format": "uri",
          "description": "Optional link to plugin docs or repo."
        }
      }
    }
  }
}
